{
  "$schema": "http://json-schema.org/draft-07/schema#",
  "$id": "state.schema.json",
  "title": "State",
  "description": "The current structured world and player state as understood after the latest turn.",
  "type": "object",
  "required": ["as_of_turn", "current_world_state", "player_state", "active_threads"],
  "additionalProperties": false,
  "properties": {
    "as_of_turn": {
      "type": "string",
      "description": "The most recent turn this state reflects.",
      "pattern": "^turn-[0-9]{3,}$"
    },
    "current_world_state": {
      "type": "string",
      "description": "Narrative summary of the current world state (explicit evidence only)."
    },
    "player_state": {
      "type": "object",
      "description": "Current status of the player character.",
      "properties": {
        "location": { "type": "string" },
        "condition": { "type": "string" },
        "inventory_notes": { "type": "string" },
        "relationships_summary": { "type": "string" },
        "hp": {
          "type": "object",
          "description": "Structured HP tracking. Optional.",
          "properties": {
            "narrative": {
              "type": "string",
              "description": "Prose description of health state."
            },
            "numeric": {
              "oneOf": [
                { "type": "integer" },
                { "type": "null" }
              ],
              "description": "Numeric HP value. Null for non-numeric games."
            },
            "max_hp": {
              "oneOf": [
                { "type": "integer" },
                { "type": "null" }
              ],
              "description": "Maximum HP. Null for non-numeric games."
            },
            "last_change": {
              "type": "object",
              "description": "Most recent HP change.",
              "properties": {
                "delta": { "type": "string" },
                "source": { "type": "string" },
                "turn": { "type": "string", "pattern": "^turn-[0-9]{3,}$" }
              },
              "additionalProperties": false
            }
          },
          "additionalProperties": false
        },
        "inventory": {
          "type": "array",
          "description": "Structured inventory. Optional.",
          "items": {
            "type": "object",
            "required": ["name"],
            "additionalProperties": false,
            "properties": {
              "item_id": {
                "oneOf": [
                  { "type": "string" },
                  { "type": "null" }
                ],
                "description": "Reference to items catalog. Null if not cataloged."
              },
              "name": { "type": "string" },
              "carried": { "type": "boolean", "default": true },
              "quantity": { "type": "integer", "minimum": 1, "default": 1 },
              "notes": {
                "oneOf": [
                  { "type": "string" },
                  { "type": "null" }
                ]
              }
            }
          }
        },
        "status_effects": {
          "type": "array",
          "description": "Active status effects on the player. Optional.",
          "items": {
            "type": "object",
            "required": ["effect"],
            "additionalProperties": false,
            "properties": {
              "effect": { "type": "string" },
              "source": { "type": "string" },
              "since_turn": { "type": "string", "pattern": "^turn-[0-9]{3,}$" }
            }
          }
        }
      },
      "additionalProperties": true
    },
    "known_constraints": {
      "type": "array",
      "description": "Constraints confirmed by explicit DM statements.",
      "items": {
        "type": "string"
      }
    },
    "inferred_constraints": {
      "type": "array",
      "description": "Constraints derived from inference. Label as inference, not fact.",
      "items": {
        "type": "object",
        "required": ["statement", "confidence", "source_turns"],
        "additionalProperties": false,
        "properties": {
          "statement": { "type": "string" },
          "confidence": {
            "type": "number",
            "minimum": 0.0,
            "maximum": 1.0
          },
          "source_turns": {
            "type": "array",
            "items": { "type": "string" }
          }
        }
      }
    },
    "opportunities": {
      "type": "array",
      "description": "Identified opportunities available to the player.",
      "items": {
        "type": "string"
      }
    },
    "risks": {
      "type": "array",
      "description": "Identified risks or threats the player faces.",
      "items": {
        "type": "string"
      }
    },
    "active_threads": {
      "type": "array",
      "description": "IDs of currently active plot threads.",
      "items": {
        "type": "string"
      }
    },
    "temporal": {
      "type": "object",
      "description": "In-game temporal tracking (season, year, last update).",
      "properties": {
        "current_season": {
          "type": "string",
          "description": "The current in-game season.",
          "enum": [
            "early_spring", "spring", "late_spring",
            "early_summer", "summer", "late_summer",
            "early_fall", "fall", "late_fall",
            "early_winter", "mid_winter", "winter", "late_winter"
          ]
        },
        "current_year": {
          "type": "integer",
          "description": "The current in-game year.",
          "minimum": 1
        },
        "last_temporal_turn": {
          "type": "string",
          "description": "Turn ID of the most recent temporal marker.",
          "pattern": "^turn-[0-9]{3,}$"
        }
      },
      "additionalProperties": false
    }
  }
}
