{
  "as_of_turn": "turn-002",
  "current_world_state": "The player has arrived at the village of Thornhaven at dusk. The village is small (~12 buildings) and appears deserted, with all shutters closed. The only light is from the inn, The Broken Wheel.",
  "player_state": {
    "location": "Thornhaven village entrance, near The Broken Wheel inn",
    "condition": "Unknown — no injury or status mentioned",
    "inventory_notes": "Not yet established",
    "relationships_summary": "No NPCs contacted yet"
  },
  "known_constraints": [
    "Village streets are empty",
    "All building shutters are closed",
    "The Broken Wheel inn is the only building showing light"
  ],
  "inferred_constraints": [
    {
      "statement": "Villagers may be hiding or under some threat that causes them to stay indoors",
      "confidence": 0.6,
      "source_turns": ["turn-002"]
    },
    {
      "statement": "The crow watching the player with 'unsettling intelligence' may be significant (familiar, omen, or narrative hook)",
      "confidence": 0.4,
      "source_turns": ["turn-002"]
    }
  ],
  "opportunities": [
    "Enter The Broken Wheel inn to gather information from whoever is inside",
    "Investigate the empty streets before entering the inn",
    "Observe the crow's behavior further"
  ],
  "risks": [
    "Unknown cause of deserted streets — could indicate danger",
    "Acting openly may reveal player's presence to unknown threats"
  ],
  "active_threads": []
}
